{
  "meta": {
    "title": "울산형 청년주거 정책방향 연구",
    "series": "기본정책과제 2026-01",
    "lab": "도시공간연구실",
    "author": "김울산",
    "pub_date": "2026년 12월",
    "director": "표상훈"
  },
  "summary": {
    "purpose": "청년 주거불안 심화에 대응하는 울산형 정책 방향을 제시함",
    "contents": "청년 가구구조·주거실태를 분석하고 정책 사각지대를 진단함",
    "conclusion": "수요맞춤형 공급과 주거비 지원 확대가 필요함",
    "utilization": "울산시 청년주거 정책 수립의 기초자료로 활용함"
  },
  "foreword": "울산은 산업도시의 성장 과정을 지나, 이제 청년이 머무를 수 있는 도시로의 전환을 모색하고 있음. 본 연구가 그 첫걸음이 되기를 바람.",
  "body": [
    {
      "kind": "chapter",
      "text": "청년주거 현황과 진단",
      "children": [
        {
          "kind": "section",
          "text": "청년 인구·가구 구조 변화",
          "children": [
            {
              "kind": "subsec",
              "text": "1인가구의 급증",
              "children": [
                {
                  "kind": "detail",
                  "text": "연령대별 분포 특성",
                  "children": [
                    {
                      "kind": "point",
                      "text": "청년 1인가구가 빠르게 증가하고 있음[^1]",
                      "children": [
                        { "kind": "sub", "text": "최근 5년간 연평균 4.2% 증가" },
                        { "kind": "sub", "text": "전체 청년가구의 절반을 상회" }
                      ]
                    },
                    {
                      "kind": "table",
                      "payload": {
                        "table": {
                          "title": "청년 가구 구조 변화",
                          "headers": ["구분", "2020년", "2025년"],
                          "rows": [
                            ["1인가구", "35%", "48%"],
                            ["신혼부부", "22%", "18%"],
                            ["기타", "43%", "34%"]
                          ],
                          "source": "통계청 인구주택총조사(2026)"
                        }
                      }
                    },
                    {
                      "kind": "figure",
                      "payload": {
                        "figure": {
                          "caption": "연구 수행 흐름도",
                          "flow": {
                            "parallel_top": ["제도·선행연구 검토", "운영 실태 분석", "타 시도 사례 비교"],
                            "steps": ["쟁점 도출", "전문가 FGI·1차 자문회의", "지침 변경(안) 도출", "2차 자문회의·보완", "최종 변경안 및 정책 제언"]
                          }
                        }
                      }
                    }
                  ]
                }
              ]
            },
            {
              "kind": "subsec",
              "text": "지역 간 편차",
              "children": [
                { "kind": "point", "text": "도심·외곽 간 주거여건 격차가 큼" }
              ]
            }
          ]
        },
        {
          "kind": "section",
          "text": "정책 사각지대",
          "children": [
            {
              "kind": "point",
              "text": "기존 공급은 신혼·가족 중심에 머무름",
              "children": [
                { "kind": "note", "text": "1인 청년가구 대상 공급은 제한적" }
              ]
            }
          ]
        }
      ]
    },
    {
      "kind": "chapter",
      "text": "정책 방향과 과제",
      "children": [
        {
          "kind": "section",
          "text": "수요맞춤형 공급 전략",
          "children": [
            { "kind": "point", "text": "청년 생애주기를 반영한 공급 유형 다변화가 필요함" },
            {
              "kind": "figure",
              "payload": {
                "figure": {
                  "caption": "청년 주거점유 형태 변화",
                  "chart": {
                    "labels": ["자가", "전세", "월세", "기타"],
                    "series": { "2020년": [15, 40, 35, 10], "2025년": [12, 28, 52, 8] }
                  }
                }
              }
            }
          ]
        }
      ]
    }
  ],
  "footnotes": {
    "1": "통계청 인구주택총조사 마이크로데이터를 재분석한 결과임(2026)."
  },
  "references": [
    "이수기(2025). 『울산 청년 주거실태 연구』. 울산연구원.",
    "국토교통부(2026). 「주거종합계획(2023-2032)」. 국토교통부.",
    "통계청(2026). 『인구주택총조사』. 통계청."
  ],
  "appendix": [
    {
      "kind": "section",
      "text": "청년 주거실태 설문 개요",
      "children": [
        { "kind": "point", "text": "조사기간: 2026년 1월 ~ 3월" },
        { "kind": "point", "text": "표본: 울산 거주 청년 1,200명" }
      ]
    }
  ]
}
